<?xml version="1.0" encoding="utf-8"?>
<config xmlns="http://transparensee.com/schema/datatool-config-5"
  xmlns:xsi="http://www.w3.org/2001/XMLSchema-instance"
  xsi:schemaLocation="
  http://transparensee.com/schema/datatool-config-5
  http://transparensee.com/schema/datatool-config-5.xsd">
  <dataSources>
    <driver name="dataSource" class="org.apache.derby.jdbc.EmbeddedDriver">
      <url>jdbc:derby:memory:test;create=true</url>
    </driver>
  </dataSources>
  <publishers>
    <sqlPublisher name="test-simple" dataSource="dataSource">
      <snapshot>
        <set-item idColumn="id" providerColumn="provider" kindColumn="kind">
          <query><![CDATA[
            SELECT id, provider, kind, value
            FROM feed_provider_data
            ORDER BY id, provider, kind
        ]]></query>
        </set-item>
        <remove-item idColumn="id" providerColumn="provider" kindColumn="kind">
          <query><![CDATA[
            SELECT id, provider, kind
            FROM feed_provider_deleted
            ORDER BY id, provider, kind
        ]]></query>
        </remove-item>
      </snapshot>
    </sqlPublisher>

    <sqlPublisher name="test-multi" dataSource="dataSource">
      <snapshot>
        <set-item idColumn="id" providerColumn="provider" kindColumn="kind">
          <query><![CDATA[
            SELECT id, provider, kind, value
            FROM feed_provider_data
            ORDER BY id, provider, kind
        ]]></query>
        </set-item>
        <set-item idColumn="id" providerColumn="provider" kindColumn="kind">
          <query><![CDATA[
            SELECT id, 'calcp' as provider, 'calck' as kind, value
            FROM feed_provider_data
            ORDER BY id, provider, kind
        ]]></query>
        </set-item>
        <set-item idColumn="id">
          <query><![CDATA[
            SELECT id, value
            FROM feed_provider_data
            ORDER BY id, provider, kind
        ]]></query>
        </set-item>
        <remove-item idColumn="id" providerColumn="provider" kindColumn="kind">
          <query><![CDATA[
            SELECT id, provider, kind
            FROM feed_provider_deleted
            ORDER BY id, provider, kind
        ]]></query>
        </remove-item>
        <remove-item idColumn="id" providerColumn="provider" kindColumn="kind">
          <query><![CDATA[
            SELECT id, 'calcp' as provider, 'calck' as kind
            FROM feed_provider_deleted
            ORDER BY id, provider, kind
        ]]></query>
        </remove-item>
        <remove-item idColumn="id">
          <query><![CDATA[
            SELECT id, provider, kind
            FROM feed_provider_deleted
            ORDER BY id, provider, kind
        ]]></query>
        </remove-item>
      </snapshot>
    </sqlPublisher>

  </publishers>
</config>
